SiteBlock,SiteBlock2,SiteIDLookUp,Description,RampMain,Direction,LaneNumbs,TotalCapacity,TMPCapacity,RampReroute,DataSource,Cluster,FreeSpeedM,ScM,NM,FreeSpeedD,ScD,ND,DetourPlan,DetourDistance,DetourSpeed,Distance,Speed ,DetourCap,DetourDelay
SH18_Eastbound_between_SH18_-_Caribbean_Drive_and_Constellation_Drive_111,SH18 EB SH18Caribberive to ConstellationDrive ,02020004,SH20 Puhinui Rd Interchange SB,Mainline,SB,2,3600,1400,02040004,Any2018-scaled,C18,90,55,1.5,65,15,1.1,SH20_93,2,50,1.6,100,1200,1.44
SH18_Westbound_between_Carribean_Drive_and_Albany_Highway_112,SH18 WB Carriberive to AlbanyHighway ,02020004,SH20 Puhinui Rd Interchange SB,Mainline,SB,2,3600,1400,02040004,Any2018-scaled,C18,90,55,1.5,65,15,1.1,SH20_93,2,50,1.6,100,1200,1.44
SH18_Eastbound_between_Albany_Highway_and_Caribbean_Drive_113,SH18 EB AlbanyHighway to Caribberive ,01820001,SH18 West of Paul Mathews Rd EB,Mainline,EB,2,3600,1400,01840002,Any2018-scaled,C11,100,85,1.3,60,20,1.1,SH18_113,3.644210982,NA,NA,NA,NA,NA
SH18_Westbound_between_Paul_Matthews_Road_and_Albany_Highway_114,SH18 WB PaulMatthewsRoad to AlbanyHighway ,02020004,SH20 Puhinui Rd Interchange SB,Mainline,SB,2,3600,1400,02040004,Any2018-scaled,C18,90,55,1.5,65,15,1.1,SH20_93,2,50,1.6,100,1200,1.44
SH18_Eastbound_between_Albany_Highway_and_Paul_Matthews_Road_115,SH18 EB AlbanyHighway to PaulMatthewsRoad ,01820001,SH18 West of Paul Mathews Rd EB,Mainline,EB,2,3600,1400,01840002,Any2018-scaled,C11,100,85,1.3,60,20,1.1,SH18_113,3.644210982,NA,NA,NA,NA,NA
SH16_Eastbound_between_Wellesley_Street_and_Grafton_Road_116,SH16 EB WellesleyStreet to GraftonRoad ,01620001,SH16 Grafton Rd On Ramp to Alten Rd EB,Mainline,EB,3,5400,1400,01640002,Website Mar-19,C5,95,70,1.1,55,15,1.1,SH16_116,1.7,60,1.3,80,1200,0.725
SH16_Eastbound_between_Wellesley_Street_and_Quay_Street_-_Tamaki_Drive_117,SH16 EB WellesleyStreet to QuayStreet TamakiDrive ,01620001,SH16 Grafton Rd On Ramp to Alten Rd EB,Mainline,EB,3,5400,1400,01640002,Website Mar-19,C5,95,70,1.1,55,15,1.1,SH16_116,1.7,60,1.3,80,1200,0.725
SH16_Eastbound_between_Beach_Road_and_Quay_Street_-_Tamaki_Drive_118,SH16 EB BeachRoad to QuayStreet TamakiDrive ,02020004,SH20 Puhinui Rd Interchange SB,Mainline,SB,2,3600,1400,02040004,Any2018-scaled,C18,90,55,1.5,65,15,1.1,SH20_93,2,50,1.6,100,1200,1.44
SH16_Westbound_between_Tamaki_Drive_and_Beach_Road_119,SH16 WB TamakiDrive to BeachRoad ,02020004,SH20 Puhinui Rd Interchange SB,Mainline,SB,2,3600,1400,02040004,Any2018-scaled,C18,90,55,1.5,65,15,1.1,SH20_93,2,50,1.6,100,1200,1.44
SH16_Westbound_between_Parnell_Rise_and_Wellesley_Street_120,SH16 WB ParnellRise to WellesleyStreet ,02020004,SH20 Puhinui Rd Interchange SB,Mainline,SB,2,3600,1400,02040004,Any2018-scaled,C18,90,55,1.5,65,15,1.1,SH20_93,2,50,1.6,100,1200,1.44
SH16_Westbound_between_Port_and_SH16_WB_Link_121,SH16 WB Port to SH 16WBLink,02020004,SH20 Puhinui Rd Interchange SB,Mainline,SB,2,3600,1400,02040004,Any2018-scaled,C18,90,55,1.5,65,15,1.1,SH20_93,2,50,1.6,100,1200,1.44
SH16_Westbound_between_Port_and_SH1_SB_Link_122,SH16 WB Port to SH1SBLink - Doubleup ,02020004,SH20 Puhinui Rd Interchange SB,Mainline,SB,2,3600,1400,02040004,Any2018-scaled,C18,90,55,1.5,65,15,1.1,SH20_93,2,50,1.6,100,1200,1.44
SH16_Westbound_between_Port_WB_Link_and_SH16_WB_Link_and_SH1_NB_Link_123,SH16 WB PortWBLink to SH16WBLink SH1NBLink - Double up ,02020004,SH20 Puhinui Rd Interchange SB,Mainline,SB,2,3600,1400,02040004,Any2018-scaled,C18,90,55,1.5,65,15,1.1,SH20_93,2,50,1.6,100,1200,1.44
SH16_Westbound_between_Hobson_Street_and_Newton_Road_124,SH16 WB HobsonStreet to NewtonRoad ,02020004,SH20 Puhinui Rd Interchange SB,Mainline,SB,2,3600,1400,02040004,Any2018-scaled,C18,90,55,1.5,65,15,1.1,SH20_93,2,50,1.6,100,1200,1.44
SH16_Westbound_between_Hobson_Street_and_St_Lukes_Road_125,SH16 WB HobsonStreet to StLukesRoad ,02020004,SH20 Puhinui Rd Interchange SB,Mainline,SB,2,3600,1400,02040004,Any2018-scaled,C18,90,55,1.5,65,15,1.1,SH20_93,2,50,1.6,100,1200,1.44
SH16_Westbound_between_St_Lukes_Road_and_Great_North_Road_126,SH16 WB StLukesRoad to GreatNorthRoad ,01610005,SH16 Newton Rd On Ramp to St Lukes Rd Off Ramp WB,Mainline,WB,4,7200,1400,01660006,Website Year2014,C15,70,25,1.5,40,25,1.5,SH16_126,4,40,3.8,105,1200,3.828571429
SH16_Westbound_between_Great_North_Road_and_Patiki_Road_127,SH16 WB GreatNorthRoad to PatikiRoad ,01619008,SH16 Great Nth Rd On Ramp to Rosebank Rd Off Ramp WB,Mainline,WB,5,9000,1400,01660008,Website Mar-19,C15,70,25,1.5,40,25,1.5,SH16_127,8.2,40,4.9,105,1200,9.5
SH16_Westbound_between_Rosebank_Road_and_Patiki_Road_128,SH16 WB RosebankRoad to PatikiRoad ,01610009,SH16 Rosebank Rd Off Ramp to Patiki Rd On Ramp WB,Mainline,WB,4,7200,1400,01660009,Any2018-scaled,C14,90,35,1.5,50,30,1.5,SH16_128,2.4,40,1.9,105,1200,2.514285714
SH16_Westbound_between_Great_North_Road_and_Te_Atatu_Road_129,SH16 WB GreatNorthRoad to TeAtatuRoad ,01619008,SH16 Great Nth Rd On Ramp to Rosebank Rd Off Ramp WB,Mainline,WB,5,9000,1400,01660008,Website Mar-19,C15,70,25,1.5,40,25,1.5,SH16_127,8.2,40,4.9,105,1200,9.5
SH16_Westbound_between_Te_Atatu_Road_and_Lincoln_Road_130,SH16 WB TeAtatuRoad to LincolnRoad ,01610011,SH16 Te Atatu Rd Interchange WB,Mainline,WB,3,5400,1400,01660011,Any2018-scaled,C14,90,35,1.5,50,30,1.5,SH16_130,4.8,40,2.7,105,1200,5.657142857
SH16_Westbound_between_Lincoln_Road_and_Brigham_Creek_Road_Roundabout_131,SH16 WB LincolnRoad to BrighamCreekRoadRoundabout ,01610013,SH16 Lincoln Rd Interchange WB,Mainline,WB,2,3600,1400,01660013,Any2018-scaled,C13,105,40,1.5,55,25,1.1,SH16_131,9.2,60,7.6,105,1200,4.857142857
SH16_Westbound_between_Royal_Road_and_Brigham_Creek_Road_Roundabout_132,SH16 WB RoyalRoad to BrighamCreekRoadRoundabout ,01610016,SH16 Royal Rd to Hobsonville Rd WB,Mainline,WB,2,3600,1400,01660015,Any2018-scaled,C13,105,40,1.5,55,25,1.1,SH16_132,6.1,50,5.1,105,1200,4.405714286
SH18_Westbound_between_SH18_Westbound_Link_and_SH16_Eastbound_133,SH18 WB SH18WestboundLink to SH 16Eastbound,02020004,SH20 Puhinui Rd Interchange SB,Mainline,SB,2,3600,1400,02040004,Any2018-scaled,C18,90,55,1.5,65,15,1.1,SH20_93,2,50,1.6,100,1200,1.44
SH16_Eastbound_between_Brigham_Creek_Road_Roundabout_and_Hobsonville_Road_134,SH16 EB BrighamCreekRoadRoundabout to HobsonvilleRoad ,02020004,SH20 Puhinui Rd Interchange SB,Mainline,SB,2,3600,1400,02040004,Any2018-scaled,C18,90,55,1.5,65,15,1.1,SH20_93,2,50,1.6,100,1200,1.44
SH20_Southbound_between_Dominion_Road_and_Hillsborough_Road_135,SH20 SB DominionRoad to HillsboroughRoad ,02020017,SH20 Dominion Rd On Ramp to Hillsborough Rd Off Ramp SB,Mainline,SB,3,5400,1400,02040018,Any2018-scaled,C16,100,80,1.5,50,25,1.2,SH20_135,4.3,50,2.5,100,1200,3.66
SH20_Northbound_between_Hillsborough_Road_and_Dominion_Road_136,SH20 NB HillsboroughRoad to DominionRoad ,02010016,SH20 Hillsborough Rd Interchange NB,Mainline,NB,3,5400,1400,02060016,Any2018-scaled,C16,100,80,1.5,50,25,1.2,SH20_136,4.4,50,2.6,100,1200,3.72
SH20_Northbound_between_Dominion_Road_and_Maioro_Street_137,SH20 NB DominionRoad to MaioroStreet ,02010018,SH20 Dominion Rd Interchange NB,Mainline,NB,3,5400,1400,02060018,Any2018-scaled,C16,100,80,1.5,50,25,1.2,SH20_137,4.1,50,2.2,100,1200,3.6
SH20_Southbound_between_Maioro_Street_and_Dominion_Road_138,SH20 SB MaioroStreet to DominionRoad ,02020019,SH20 Maioro St On Ramp to Dominion Rd Off Ramp SB,Mainline,SB,3,5400,1400,02040020,Any2018-scaled,C16,100,80,1.5,50,25,1.2,SH20_138,3.8,50,2.2,100,1200,3.24
SH20_Southbound_between_Lambie_Drive_and_SH1_Link_139,SH20 SB LambieDrive to SH 1Link,02020000,SH20 Southern Link to SH1N Off Ramp SB,Mainline,SB,2,3600,1400,02040001,Any2018-scaled,C18,90,55,1.5,65,15,1.1,SH20_139,3.4,50,2.9,100,1200,2.34
SH20_Southbound_between_Lambie_Drive_and_SH20-SH1_Southbound_Link_140,SH20 SB LambieDrive to SH20 SH 1SBLink,02020000,SH20 Southern Link to SH1N Off Ramp SB,Mainline,SB,2,3600,1400,02040001,Any2018-scaled,C18,90,55,1.5,65,15,1.1,SH20_139,3.4,50,2.9,100,1200,2.34
SH18_Westbound_between_Albany_Highway_and_Tauhinu_Road_142,SH18 WB AlbanyHighway to TauhinuRoad ,01819001,SH18 West of Unsworth Dr WB,Mainline,WB,1,2400,1400,01860002,Any2018-scaled,C11,100,85,1.3,60,20,1.1,SH18_142,5.3,60,4.7,105,1917.391304,2.614285714
SH18_Eastbound_between_Tauhinu_Road_and_Albany_Highway_143,SH18 EB TauhinuRoad to AlbanyHighway ,01820005,SH18 Tauhinu Rd Off Ramp to Greenhithe Rd On Ramp EB,Mainline,EB,2,3800,1400,01840006,Any2018-scaled,C11,100,85,1.3,60,20,1.1,SH18_143,5.4,60,4.7,105,1917.391304,2.714285714
SH18_Westbound_between_Squadron_Drive_and_Brigham_Creek_Road_144,SH18 WB SquadronDrive to BrighamCreekRoad ,01810007,SH18 Upper Harbour Bridge WB,Mainline,WB,2,4200,1400,01860008,Any2018-scaled,C12,105,85,1.1,55,25,1.1,SH18_144,3.4,60,3.1,105,1200,1.628571429
SH18_Eastbound_between_Brigham_Creek_Road_and_Squadron_Drive_145,SH18 EB BrighamCreekRoad to SquadronDrive ,01820009,SH18 Brigham Creek Rd On Ramp to Squadron Dr On Ramp EB,Mainline,EB,2,3600,1400,01840010,Website Mar-18,C12,105,85,1.1,55,25,1.1,SH18_145,3.7,60,3.1,105,1200,1.928571429
SH18_Westbound_between_Brigham_Creek_Road_and_SH16_EB_Link_Hobsonville_Road_146,SH18 WB BrighamCreekRoad to SH16EBLink HobsonvilleRoad ,01810010,SH18 Brigham Creek Rd Interchange WB,Mainline,WB,2,3600,1400,01860010,Website Mar-18,C12,105,85,1.1,55,25,1.1,SH18_146,4.6,60,4.2,105,1200,2.2
SH18_Westbound_between_Westgate_Off-ramp_and_Brigham_Creek_Road_147,SH18 WB WestgateOfframp to BrighamCreekRoad ,01810012,SH18 Trig Rd Off Ramp to Hobsonville Rd Off Ramp WB,Mainline,WB,2,3600,1400,01860013,Website Mar-18,C12,105,85,1.1,55,25,1.1,SH18_147,5.132504553,NA,NA,NA,NA,NA
SH16_Eastbound_between_Hobsonville_Road_and_Royal_Road_148,SH16 EB HobsonvilleRoad to RoyalRoad ,02020004,SH20 Puhinui Rd Interchange SB,Mainline,SB,2,3600,1400,02040004,Any2018-scaled,C18,90,55,1.5,65,15,1.1,SH20_93,2,50,1.6,100,1200,1.44
SH16_Eastbound_between_Hobsonville_Road_and_Royal_Road_148,SH16 EB HobsonvilleRoad to RoyalRoad ,02020004,SH20 Puhinui Rd Interchange SB,Mainline,SB,2,3600,1400,02040004,Any2018-scaled,C18,90,55,1.5,65,15,1.1,SH20_93,2,50,1.6,100,1200,1.44
SH16_Eastbound_between_Hobsonville_Road_and_Lincoln_Road_149,SH16 EB HobsonvilleRoad to LincolnRoad ,02020004,SH20 Puhinui Rd Interchange SB,Mainline,SB,2,3600,1400,02040004,Any2018-scaled,C18,90,55,1.5,65,15,1.1,SH20_93,2,50,1.6,100,1200,1.44
SH16_Eastbound_between_Lincoln_Road_and_Te_Atatu_Road_150,SH16 EB LincolnRoad to TeAtatuRoad ,01620012,SH16 Lincoln Rd Off Ramp to Te Atatu Rd On Ramp EB,Mainline,EB,3,5400,1400,01640013,Website Mar-19,C13,105,40,1.5,55,25,1.1,SH16_150,5.9,40,3,105,1200,7.135714286
SH16_Eastbound_between_Te_Atatu_Road_and_Great_North_Road_151,SH16 EB TeAtatuRoad to GreatNorthRoad ,01620010,SH16 Te Atatu Peninsula On Ramp to Patiki Rd Off Ramp EB,Mainline,EB,4,8800,1400,01640011,Website Mar-19,C14,90,35,1.5,50,30,1.5,SH16_151,14.8,40,6.2,105,1200,18.65714286
SH16_Eastbound_between_Patiki_Road_and_Rosebank_Road_152,SH16 EB PatikiRoad to RosebankRoad ,01629008,SH16 Rosebank Rd On Ramp to Great Nth Rd Off Ramp EB,Mainline,EB,4,7200,1400,01640010,Website Mar-19,C15,70,25,1.5,40,25,1.5,SH16_152,2.5,40,1.9,105,1200,2.664285714
SH16_Eastbound_between_Patiki_Road_and_Great_North_Road_153,SH16 EB PatikiRoad to GreatNorthRoad ,01629008,SH16 Rosebank Rd On Ramp to Great Nth Rd Off Ramp EB,Mainline,EB,4,7200,1400,01640010,Website Mar-19,C15,70,25,1.5,40,25,1.5,SH16_152,2.5,40,1.9,105,1200,2.664285714
SH16_Eastbound_between_Great_North_Road_and_Western_Springs_154,SH16 EB GreatNorthRoad to WesternSprings ,01620007,SH16 Great Nth Rd On Ramp to St Lukes Rd Off Ramp EB,Mainline,EB,4,7200,1400,01640008,Website Mar-19,C15,70,25,1.5,40,25,1.5,SH16_154,4,40,3.9,105,1200,3.771428571
"SH16_Eastbound_between_Western_Springs_and_SH1_SB,_NB_and_SH16_Port_155",SH16 EB WesternSprings to SH1SB NB to SH 16Port,01620005,SH16 St Lukes Rd On Ramp to Newton Rd Off Ramp EB,Mainline,EB,4,7600,1400,01640006,Website Mar-18,C15,70,25,1.5,40,25,1.5,SH16_155,8.2,40,6,100,1200,8.7
SH16_Eastbound_between_SH16_to_SH1_SB_and_Khyber_Pass_Road_156,SH16 EB SH16 to SH1 SB KhyberPassRoad ,02020004,SH20 Puhinui Rd Interchange SB,Mainline,SB,2,3600,1400,02040004,Any2018-scaled,C18,90,55,1.5,65,15,1.1,SH20_93,2,50,1.6,100,1200,1.44
SH1_Southbound_between_Johnstones_Hill_Tunnel_and_Silverdale_157,SH1 SB JohnstonesHillTunnel to Silverdale ,02020004,SH20 Puhinui Rd Interchange SB,Mainline,SB,2,3600,1400,02040004,Any2018-scaled,C18,90,55,1.5,65,15,1.1,SH20_93,2,50,1.6,100,1200,1.44
SH1_Northbound_between_Silverdale_Off-Ramp_and_Waiwera_(Johnstone_Hill_Tunnel)_158,SH1 NB SilverdaleOffRamp to Waiwera(JohnstoneHillTunnel) ,01N20391,SH1 Silverdale On Ramp to Orewa Off Ramp NB,Mainline,NB,2,3600,1400,01N40398,Any2018-scaled,C1,100,65,1.5,60,25,1.2,SH1_61,17.7,60,13.2,105,1200,10.15714286
SH1_Southbound_between_Grand_Drive_and_Silverdale_160,SH1 SB GrDrive to Silverdale ,02020004,SH20 Puhinui Rd Interchange SB,Mainline,SB,2,3600,1400,02040004,Any2018-scaled,C18,90,55,1.5,65,15,1.1,SH20_93,2,50,1.6,100,1200,1.44
SH16_Eastbound_between_SH16_EB_Link_and_SH18_EB_162,SH16 EB SH16EBLink to SH 18EB,02020004,SH20 Puhinui Rd Interchange SB,Mainline,SB,2,3600,1400,02040004,Any2018-scaled,C18,90,55,1.5,65,15,1.1,SH20_93,2,50,1.6,100,1200,1.44
SH16_Westbound_between_Hobsonville_Road_and_Brigham_Creek_Road_Roundabout_163,SH16 WB HobsonvilleRoad to BrighamCreekRoadRoundabout ,01820012,SH18 Hobsonville Rd On Ramp to Trig Rd On Ramp EB,Mainline,EB,2,3600,1400,01669017,Website Mar-18,C12,105,85,1.1,55,25,1.1,SH16_163,4.7,80,3.9,105,1917.391304,1.296428571
SH18_Westbound_between_Westbound_Link_and_SH16_Eastbound_165,SH18 WB WestboundLink to SH 16Eastbound,02020004,SH20 Puhinui Rd Interchange SB,Mainline,SB,2,3600,1400,02040004,Any2018-scaled,C18,90,55,1.5,65,15,1.1,SH20_93,2,50,1.6,100,1200,1.44
SH18_Westbound_between_Albany_Highway_and_Brigham_Creek_Road_166,SH18 WB AlbanyHighway to BrighamCreekRoad ,01819001,SH18 West of Unsworth Dr WB,Mainline,WB,1,2400,1400,01860002,Any2018-scaled,C11,100,85,1.3,60,20,1.1,SH18_142,5.3,60,4.7,105,1917.391304,2.614285714
SH18_Eastbound_between_Brigham_Creek_Road_and_Albany_Highway_167,SH18 EB BrighamCreekRoad to AlbanyHighway ,01820009,SH18 Brigham Creek Rd On Ramp to Squadron Dr On Ramp EB,Mainline,EB,2,3600,1400,01840010,Website Mar-18,C12,105,85,1.1,55,25,1.1,SH18_145,3.7,60,3.1,105,1200,1.928571429
SH20_Northbound_between_Link_To_SH20A_Westbound_and_168,SH20 NB Link to SH20A Westbound ,02020004,SH20 Puhinui Rd Interchange SB,Mainline,SB,2,3600,1400,02040004,Any2018-scaled,C18,90,55,1.5,65,15,1.1,SH20_93,2,50,1.6,100,1200,1.44
SH1_Northbound_and_SH16_Westbound_between_Market_Road_and_Grafton_Road_170,SH1 NB SH16 WB MarketRoad to GraftonRoad ,01N20430,SH1 Gillies Ave On Ramp to Khyber Pass Off Ramp NB,Mainline,NB,5,9000,1400,01N40432,Website Mar-18,C6,85,65,1.1,60,20,1.1,SH1_45,2.6,40,2.3,105,1200,2.585714286
SH1_Northbound_between_Symonds_Street_and_SH16_Newton_Rd_On-Ramp_171,SH1 NB SymondsStreet to SH16 NewtonRd OnRamp ,01N20429,SH1 Symonds/Wellesley/Port Off Ramp to SH16 Off Ramp NB,Mainline,NB,4,7200,1400,01N45429,Continuous Mar-19,C5,95,70,1.1,55,15,1.1,SH1_48,3.8,70,1.9,105,1200,2.171428571
SH16_Westbound_between_Royal_Road_and_Brigham_Creek_Road_Roundabout_173,SH16 WB RoyalRoad to BrighamCreekRoadRoundabout ,01610016,SH16 Royal Rd to Hobsonville Rd WB,Mainline,WB,2,3600,1400,01660015,Any2018-scaled,C13,105,40,1.5,55,25,1.1,SH16_132,6.1,50,5.1,105,1200,4.405714286
SH16_Westbound_between_SH16_WB_To_SH18_EB_Link_and_SH18_EB_200,SH16 WB SH16WB to SH18EBLink SH 18EB,02020004,SH20 Puhinui Rd Interchange SB,Mainline,SB,2,3600,1400,02040004,Any2018-scaled,C18,90,55,1.5,65,15,1.1,SH20_93,2,50,1.6,100,1200,1.44
SH16_Westbound_between_Hobsonville_Road_Off-ramp_and_201,SH16 WB HobsonvilleRoad Offramp ,01820012,SH18 Hobsonville Rd On Ramp to Trig Rd On Ramp EB,Mainline,EB,2,3600,1400,01669017,Website Mar-18,C12,105,85,1.1,55,25,1.1,SH16_163,4.7,80,3.9,105,1917.391304,1.296428571
SH16_Westbound_between_Royal_Road_Off-ramp_and_202,SH16 WB RoyalRoad Offramp ,01610016,SH16 Royal Rd to Hobsonville Rd WB,Mainline,WB,2,3600,1400,01660015,Any2018-scaled,C13,105,40,1.5,55,25,1.1,SH16_132,6.1,50,5.1,105,1200,4.405714286
SH16_Eastbound_between_Lincoln_Road_Off-ramp_and_203,SH16 EB LincolnRoad Offramp ,01620012,SH16 Lincoln Rd Off Ramp to Te Atatu Rd On Ramp EB,Mainline,EB,3,5400,1400,01640013,Website Mar-19,C13,105,40,1.5,55,25,1.1,SH16_150,5.9,40,3,105,1200,7.135714286
SH16_Westbound_between_Lincoln_Road_Off-ramp_and_204,SH16 WB LincolnRoad Offramp ,01610013,SH16 Lincoln Rd Interchange WB,Mainline,WB,2,3600,1400,01660013,Any2018-scaled,C13,105,40,1.5,55,25,1.1,SH16_131,9.2,60,7.6,105,1200,4.857142857
SH16_Eastbound_between_Te-Atatu_Road_Off-ramp_and_205,SH16 EB TeAtatuRoad Offramp ,01620010,SH16 Te Atatu Peninsula On Ramp to Patiki Rd Off Ramp EB,Mainline,EB,4,8800,1400,01640011,Website Mar-19,C14,90,35,1.5,50,30,1.5,SH16_151,14.8,40,6.2,105,1200,18.65714286
SH16_Westbound_between_Te_Atatu_Road_Off-Ramp_and_206,SH16 WB TeAtatuRoad OffRamp ,01610011,SH16 Te Atatu Rd Interchange WB,Mainline,WB,3,5400,1400,01660011,Any2018-scaled,C14,90,35,1.5,50,30,1.5,SH16_130,4.8,40,2.7,105,1200,5.657142857
SH16_Eastbound_between_Patiki_Road_Off-ramp_and_207,SH16 EB PatikiRoad Offramp ,01629008,SH16 Rosebank Rd On Ramp to Great Nth Rd Off Ramp EB,Mainline,EB,4,7200,1400,01640010,Website Mar-19,C15,70,25,1.5,40,25,1.5,SH16_152,2.5,40,1.9,105,1200,2.664285714
SH16_Westbound_between_Rosebank_Road_Off-ramp_and_208,SH16 WB RosebankRoad Offramp ,01610009,SH16 Rosebank Rd Off Ramp to Patiki Rd On Ramp WB,Mainline,WB,4,7200,1400,01660009,Any2018-scaled,C14,90,35,1.5,50,30,1.5,SH16_128,2.4,40,1.9,105,1200,2.514285714
SH16_Eastbound_between_Great_North_Road_Off-ramp_and_209,SH16 EB GreatNorthRoad Offramp ,01620007,SH16 Great Nth Rd On Ramp to St Lukes Rd Off Ramp EB,Mainline,EB,4,7200,1400,01640008,Website Mar-19,C15,70,25,1.5,40,25,1.5,SH16_154,4,40,3.9,105,1200,3.771428571
SH16_Westbound_between_Great_North_Road_Off-ramp_and_210,SH16 WB GreatNorthRoad Offramp,01619008,SH16 Great Nth Rd On Ramp to Rosebank Rd Off Ramp WB,Mainline,WB,5,9000,1400,01660008,Website Mar-19,C15,70,25,1.5,40,25,1.5,SH16_127,8.2,40,4.9,105,1200,9.5
SH16_Eastbound_between_Western_Springs_Off-Ramp_and_211,SH16 EB WesternSprings OffRamp ,01620005,SH16 St Lukes Rd On Ramp to Newton Rd Off Ramp EB,Mainline,EB,4,7600,1400,01640006,Website Mar-18,C15,70,25,1.5,40,25,1.5,SH16_155,8.2,40,6,100,1200,8.7
SH16_Westbound_between_St_Lukes_Road_Off-ramp_and_212,SH16 WB StLukesRoad Offramp ,01610005,SH16 Newton Rd On Ramp to St Lukes Rd Off Ramp WB,Mainline,WB,4,7200,1400,01660006,Website Year2014,C15,70,25,1.5,40,25,1.5,SH16_126,4,40,3.8,105,1200,3.828571429
SH16_Eastbound_between_Newton_Road_Off-ramp_and_213,SH16 EB NewtonRoadOframp ,02020004,SH20 Puhinui Rd Interchange SB,Mainline,SB,2,3600,1400,02040004,Any2018-scaled,C18,90,55,1.5,65,15,1.1,SH20_93,2,50,1.6,100,1200,1.44
SH16_Eastbound_between_SH16_EB_-_SH1_NB_Link_and_214,SH16 EB SH16EB to SH1NBLink ,02020004,SH20 Puhinui Rd Interchange SB,Mainline,SB,2,3600,1400,02040004,Any2018-scaled,C18,90,55,1.5,65,15,1.1,SH20_93,2,50,1.6,100,1200,1.44
SH16_Eastbound_between_Nelson_Street_-_SH1_NB_Link_(Both_Links_Closed)_and_SH1_Northbound_215,SH16 EB NelsonStreet-SH 1NBLink(BothLinksClosed)SH,02020004,SH20 Puhinui Rd Interchange SB,Mainline,SB,2,3600,1400,02040004,Any2018-scaled,C18,90,55,1.5,65,15,1.1,SH20_93,2,50,1.6,100,1200,1.44
SH16_Eastbound_between_SH16_EB_-_SH1_SB_Link_and_216,SH16 EB SH16EB to SH 1SBLink,02020004,SH20 Puhinui Rd Interchange SB,Mainline,SB,2,3600,1400,02040004,Any2018-scaled,C18,90,55,1.5,65,15,1.1,SH20_93,2,50,1.6,100,1200,1.44
SH16_Eastbound_between_SH16_EB_to_SH16_Port_and_217,SH16 EB SH16EB to SH 16Port,02020004,SH20 Puhinui Rd Interchange SB,Mainline,SB,2,3600,1400,02040004,Any2018-scaled,C18,90,55,1.5,65,15,1.1,SH20_93,2,50,1.6,100,1200,1.44
SH16_Eastbound_between_Wellesley_Street_Off-ramp_and_218,SH16 EB WellesleyStreet Offramp ,01620001,SH16 Grafton Rd On Ramp to Alten Rd EB,Mainline,EB,3,5400,1400,01640002,Website Mar-19,C5,95,70,1.1,55,15,1.1,SH16_116,1.7,60,1.3,80,1200,0.725
SH16_Westbound_between_SH16_Stanley_Street_Off-ramp_and_220,SH16 WB SH16StanleyStreet Offramp ,02020004,SH20 Puhinui Rd Interchange SB,Mainline,SB,2,3600,1400,02040004,Any2018-scaled,C18,90,55,1.5,65,15,1.1,SH20_93,2,50,1.6,100,1200,1.44
SH16_Westbound_between_SH16_WB_-_SH1_SB_Link_and_221,SH16 WB SH 16WB-SH,02020004,SH20 Puhinui Rd Interchange SB,Mainline,SB,2,3600,1400,02040004,Any2018-scaled,C18,90,55,1.5,65,15,1.1,SH20_93,2,50,1.6,100,1200,1.44
SH16_Westbound_between_SH16_WB_-_SH1_NB_Link_and_222,SH16 WB SH16 WB SH1 NB Link ,02020004,SH20 Puhinui Rd Interchange SB,Mainline,SB,2,3600,1400,02040004,Any2018-scaled,C18,90,55,1.5,65,15,1.1,SH20_93,2,50,1.6,100,1200,1.44
SH1_Southbound_between_Hibiscus_Coast_Highway_SB_Off-ramp_and_223,SH1 SB Hibiscus Coast Highway SB Off ramp ,02020004,SH20 Puhinui Rd Interchange SB,Mainline,SB,2,3600,1400,02040004,Any2018-scaled,C18,90,55,1.5,65,15,1.1,SH20_93,2,50,1.6,100,1200,1.44
SH1_Southbound_between_Grand_Drive_Off-ramp_and_224,SH1 SB Gr Drive Off ramp ,02020004,SH20 Puhinui Rd Interchange SB,Mainline,SB,2,3600,1400,02040004,Any2018-scaled,C18,90,55,1.5,65,15,1.1,SH20_93,2,50,1.6,100,1200,1.44
SH1_Northbound_between_Grand_Drive_Off-ramp_and_225,SH1 NB Gr Drive Off ramp ,02020004,SH20 Puhinui Rd Interchange SB,Mainline,SB,2,3600,1400,02040004,Any2018-scaled,C18,90,55,1.5,65,15,1.1,SH20_93,2,50,1.6,100,1200,1.44
SH1_Southbound_between_Silverdale_Off-ramp_and_226,SH1 SB Silverdale Off ramp ,01N10398,SH1 Silverdale Interchange SB,Mainline,SB,2,3600,1400,01N60398,Continuous Mar-19,C1,100,65,1.5,60,25,1.2,SH1_63,18.3,90,12.9,105,1865.769231,4.828571429
SH1_Northbound_between_Silverdale_Off-ramp_and_227,SH1 NB Silverdale Off ramp ,01N20391,SH1 Silverdale On Ramp to Orewa Off Ramp NB,Mainline,NB,2,3600,1400,01N40398,Any2018-scaled,C1,100,65,1.5,60,25,1.2,SH1_61,17.7,60,13.2,105,1200,10.15714286
SH1_Southbound_between_Oteha_Valley_Road_Off-ramp_and_228,SH1 SB Oteha Valley Road Off ramp ,01N10410,SH1 Oteha Valley Rd Interchange SB,Mainline,SB,2,3600,1400,01N60410,Any2018-scaled,C2,100,35,1.5,65,25,1.1,SH1_64,5.3,50,3.2,105,1200,4.531428571
SH1_Northbound_between_Oteha_Valley_Road_Off-ramp_and_229,SH1 NB Oteha Valley Road Off ramp ,01N20400,SH1 Silverdale to Dairy Flat SC On Ramp NB,Mainline,NB,2,3600,1400,01N40410,Any2018-scaled,C1,100,65,1.5,60,25,1.2,SH1_60,18.5,90,13.2,105,1865.769231,4.79047619
SH1_Southbound_between_Greville_Road_Off-ramp_and_230,SH1 SB Greville Road Off ramp ,01N10412,SH1 Greville Rd Interchange SB,Mainline,SB,2,3600,1400,01N60412,Any2018-scaled,C2,100,35,1.5,65,25,1.1,SH1_65,6.5,40,3.4,105,1200,7.807142857
SH1_Northbound_between_Greville_Road_Off-ramp_and_231,SH1 NB Greville Road Off ramp ,01N29411,SH1 Albany Bus Station Off Ramp to Greville Rd On Ramp NB,Mainline,NB,3,5400,1400,01N40412,Any2018-scaled,C2,100,35,1.5,65,25,1.1,SH1_59,4.7,50,3.1,105,1200,3.868571429
SH1_Southbound_between_Upper_Harbour_Highway_Off-ramp_and_233,SH1 SB Upper Harbour Highway Off ramp ,01N10414,SH1 Upper Harbour Hwy Interchange SB,Mainline,SB,2,3600,1400,01N60414,Continuous Mar-19,C3,85,35,1.5,55,20,1.4,SH1_66,6.3,50,3.7,105,1200,5.445714286
SH1_Northbound_between_Upper_Harbour_Highway_Off-ramp_and_234,SH1 NB Upper Harbour Highway Off ramp ,01N20413,SH1 Upper Harbour Hwy On Ramp to Greville Rd Off Ramp NB,Mainline,NB,3,6000,1400,01N40414,Any2018-scaled,C2,100,35,1.5,65,25,1.1,SH1_58,6.8,40,3.8,105,1200,8.028571429
SH1_Southbound_between_Tristram_Avenue_Off-ramp_and_235,SH1 SB Tristram Avenue Off ramp ,01N10417,SH1 Tristram Ave Interchange SB,Mainline,SB,2,4000,1400,01N60417,Continuous Mar-19,C3,85,35,1.5,55,20,1.4,SH1_67,3.9,40,2.9,105,1200,4.192857143
SH1_Northbound_between_Tristram_Avenue_Off-ramp_and_236,SH1 NB Tristram Avenue Off ramp ,01N20415,SH1 Tristram Ave On Ramp to Upper Harbour Hwy Off Ramp NB,Mainline,NB,3,5400,1400,01N40417,Any2018-scaled,C3,85,35,1.5,55,20,1.4,SH1_57,7.5,50,3.9,105,1200,6.771428571
SH1_Southbound_between_Northcote_Road_Off-ramp_and_237,SH1 SB Northcote Road Off ramp ,01N10419,SH1 Northcote Rd Interchange SB,Mainline,SB,3,5400,1400,01N60419,Continuous Mar-19,C4,100,85,1.3,55,25,1.3,SH1_68,3.5,40,2.6,105,1200,3.764285714
SH1_Northbound_between_Northcote_Road_Off-ramp_and_238,SH1 NB Northcote Road Off ramp ,01N20418,SH1 Northcote Rd On Ramp to Tristram Ave Off Ramp NB,Mainline,NB,4,7200,1400,01N40419,Any2018-scaled,C4,100,85,1.3,55,25,1.3,SH1_56,3.7,40,3.1,105,1200,3.778571429
SH1_Southbound_between_Esmonde_Road_Off-ramp_and_239,SH1 SB Esmonde Road Off ramp ,01N10420,SH1 Esmonde Rd Interchange SB,Mainline,SB,3,5400,1400,01N60420,Any2018-scaled,C4,100,85,1.3,55,25,1.3,NA,NA,NA,NA,NA,NA,NA
SH1_Northbound_between_Esmonde_Road_Off-ramp_and_240,SH1 NB Esmonde Road Off ramp ,01N29419,SH1 Esmonde/Akoranga On Ramp to Northcote Rd Off Ramp to NB,Mainline,NB,4,7200,1400,01N40420,Website Mar-19,C4,100,85,1.3,55,25,1.3,SH1_55,3.1,40,2.7,105,1200,3.107142857
SH1_Southbound_between_Onewa_Road_Off-ramp_and_241,SH1 SB Onewa Road Off ramp ,01N10422,SH1 Onewa Rd Interchange SB,Mainline,SB,3,6300,1400,01N60422,Any2018-scaled,C4,100,85,1.3,55,25,1.3,NA,NA,NA,NA,NA,NA,NA
SH1_Northbound_between_Onewa_Road_Off-ramp_and_242,SH1 NB Onewa Road Off ramp ,01N20421,SH1 Onewa Rd On Ramp to Esmonde Rd Off Ramp NB,Mainline,NB,4,7200,1400,01N40422,Any2018-scaled,C4,100,85,1.3,55,25,1.3,SH1_54,4.6,40,4.2,105,1200,4.5
SH1_Northbound_between_Stafford_Road_Off-ramp_and_243,SH1 NB Stafford Road Off ramp ,02020004,SH20 Puhinui Rd Interchange SB,Mainline,SB,2,3600,1400,02040004,Any2018-scaled,C18,90,55,1.5,65,15,1.1,SH20_93,2,50,1.6,100,1200,1.44
SH1_Southbound_between_Shelley_Beach_Road_Off-ramp_and_244,SH1 SB Shelley Beach Road Off ramp ,02020004,SH20 Puhinui Rd Interchange SB,Mainline,SB,2,3600,1400,02040004,Any2018-scaled,C18,90,55,1.5,65,15,1.1,SH20_93,2,50,1.6,100,1200,1.44
